<ns:XmlFPE targetNamespace="http://atlasmap.io/xml/test/v2" xmlns:ns="http://atlasmap.io/xml/test/v2" xmlns:xsi="http://www.w3.org/2001/XMLSchema-instance" xsi:schemaLocation="http://atlasmap.io/xml/test/v2 atlas-xml-test-model-v2.xsd ">
  <booleanField>false</booleanField>
  <byteField>99</byteField>
  <charField>a</charField>
  <doubleField>50000000.0</doubleField>
  <floatField>40000000.0</floatField>
  <intField>2</intField>
  <longField>30000</longField>
  <shortField>1</shortField>
</ns:XmlFPE>