<ns:XmlOE xmlns:ns="http://atlasmap.io/xml/test/v2" xmlns:xsi="http://www.w3.org/2001/XMLSchema-instance" xsi:schemaLocation="http://atlasmap.io/xml/test/v2 atlas-xml-test-model-v2.xsd ">
  <ns:orderId>ns:orderId</ns:orderId>
  <ns:Address>
    <ns:addressLine1>ns:addressLine1</ns:addressLine1>
    <ns:addressLine2>ns:addressLine2</ns:addressLine2>
    <ns:city>ns:city</ns:city>
    <ns:state>ns:state</ns:state>
    <ns:zipCode>ns:zipCode</ns:zipCode>
  </ns:Address>
  <ns:Contact>
    <ns:firstName>ns:firstName</ns:firstName>
    <ns:lastName>ns:lastName</ns:lastName>
    <ns:phoneNumber>ns:phoneNumber</ns:phoneNumber>
    <ns:zipCode>ns:zipCode</ns:zipCode>
  </ns:Contact>
</ns:XmlOE>